{
  "findings": [
    {
      "detail": "CODE_EXECUTION_MAX_ALLOCATIONS appears in an environment template but has no field in Settings and no Compose consumer. Because Settings uses extra=\"ignore\", setting it has no effect and produces no warning.",
      "id": "unconsumed-code-execution-max-allocations",
      "kind": "unconsumed",
      "status": "open"
    },
    {
      "detail": "ENABLE_CODE_EXECUTION appears in an environment template but has no field in Settings and no Compose consumer. Because Settings uses extra=\"ignore\", setting it has no effect and produces no warning.",
      "id": "unconsumed-enable-code-execution",
      "kind": "unconsumed",
      "status": "open"
    },
    {
      "detail": "OPENAI_API_KEY appears in an environment template but has no field in Settings and no Compose consumer. Because Settings uses extra=\"ignore\", setting it has no effect and produces no warning.",
      "id": "unconsumed-openai-api-key",
      "kind": "unconsumed",
      "status": "open"
    }
  ],
  "provenance": {
    "extractor_version": "1.0.0",
    "method": "extracted",
    "sources": [
      "backend/.env.example",
      "backend/app/core/config.py",
      "docker-compose.yml",
      "frontend/.env.example",
      "frontend/src/**",
      "governance/manifests/curated/architectural-intent.json"
    ]
  },
  "schema_version": 1,
  "secret_list_source": "curated",
  "variables": [
    {
      "classification": [
        "runtime"
      ],
      "consumed_by": [],
      "declared_in": [
        "backend/app/core/config.py",
        "backend/.env.example"
      ],
      "default": "30",
      "default_class": "literal",
      "name": "ACCESS_TOKEN_EXPIRE_MINUTES",
      "required": false,
      "surface": "backend",
      "type": "int"
    },
    {
      "classification": [
        "compose-only"
      ],
      "consumed_by": [
        "traefik"
      ],
      "declared_in": [
        "backend/.env.example",
        "docker-compose.yml"
      ],
      "default": "admin@example.com",
      "default_class": "literal",
      "description": "Let's Encrypt email for SSL certificates",
      "name": "ACME_EMAIL",
      "required": false,
      "surface": "backend",
      "type": null
    },
    {
      "classification": [
        "runtime"
      ],
      "consumed_by": [],
      "declared_in": [
        "backend/app/core/config.py"
      ],
      "default": null,
      "default_class": "none",
      "name": "AI_AVAILABLE_MODELS",
      "required": false,
      "surface": "backend",
      "type": "list[str]"
    },
    {
      "classification": [
        "runtime"
      ],
      "consumed_by": [],
      "declared_in": [
        "backend/app/core/config.py"
      ],
      "default": "pydantic_ai",
      "default_class": "literal",
      "name": "AI_FRAMEWORK",
      "required": false,
      "surface": "backend",
      "type": "str"
    },
    {
      "classification": [
        "runtime"
      ],
      "consumed_by": [
        "agents"
      ],
      "declared_in": [
        "backend/app/core/config.py",
        "backend/.env.example"
      ],
      "default": "anthropic/claude-opus-4-7",
      "default_class": "literal",
      "name": "AI_MODEL",
      "required": false,
      "surface": "backend",
      "type": "str"
    },
    {
      "classification": [
        "runtime"
      ],
      "consumed_by": [],
      "declared_in": [
        "backend/app/core/config.py"
      ],
      "default": "0.7",
      "default_class": "literal",
      "name": "AI_TEMPERATURE",
      "required": false,
      "surface": "backend",
      "type": "float"
    },
    {
      "classification": [
        "runtime"
      ],
      "consumed_by": [],
      "declared_in": [
        "backend/app/core/config.py",
        "backend/.env.example"
      ],
      "default": "medium",
      "default_class": "literal",
      "name": "AI_THINKING_EFFORT",
      "required": false,
      "surface": "backend",
      "type": "str"
    },
    {
      "classification": [
        "runtime"
      ],
      "consumed_by": [],
      "declared_in": [
        "backend/app/core/config.py",
        "backend/.env.example"
      ],
      "default": "false",
      "default_class": "literal",
      "name": "AI_THINKING_ENABLED",
      "required": false,
      "surface": "backend",
      "type": "bool"
    },
    {
      "classification": [
        "runtime"
      ],
      "consumed_by": [],
      "declared_in": [
        "backend/app/core/config.py",
        "backend/.env.example"
      ],
      "default": "HS256",
      "default_class": "literal",
      "name": "ALGORITHM",
      "required": false,
      "surface": "backend",
      "type": "str"
    },
    {
      "classification": [
        "runtime",
        "secret"
      ],
      "consumed_by": [
        "backend-api"
      ],
      "declared_in": [
        "backend/app/core/config.py",
        "backend/.env.example"
      ],
      "default": null,
      "default_class": "none",
      "name": "API_KEY",
      "required": false,
      "surface": "backend",
      "type": "str"
    },
    {
      "classification": [
        "runtime"
      ],
      "consumed_by": [],
      "declared_in": [
        "backend/app/core/config.py",
        "backend/.env.example"
      ],
      "default": "X-API-Key",
      "default_class": "literal",
      "name": "API_KEY_HEADER",
      "required": false,
      "surface": "backend",
      "type": "str"
    },
    {
      "classification": [
        "runtime"
      ],
      "consumed_by": [],
      "declared_in": [
        "backend/app/core/config.py"
      ],
      "default": "/api/v1",
      "default_class": "literal",
      "name": "API_V1_STR",
      "required": false,
      "surface": "backend",
      "type": "str"
    },
    {
      "classification": [
        "runtime"
      ],
      "consumed_by": [
        "compose:frontend",
        "frontend-app",
        "frontend:frontend/src/app/[locale]/demo/[id]/page.tsx",
        "frontend:frontend/src/app/[locale]/demo/page.tsx",
        "frontend:frontend/src/app/[locale]/shared/[token]/page.tsx"
      ],
      "declared_in": [
        "frontend/.env.example",
        "docker-compose.yml"
      ],
      "default": "http://localhost:8100",
      "default_class": "literal",
      "description": "Backend API URL (server-side only - not exposed to browser)",
      "name": "BACKEND_URL",
      "required": false,
      "surface": "frontend",
      "type": null
    },
    {
      "classification": [
        "runtime"
      ],
      "consumed_by": [
        "compose:frontend",
        "frontend-app"
      ],
      "declared_in": [
        "docker-compose.yml"
      ],
      "default": null,
      "default_class": "none",
      "name": "BACKEND_WS_URL",
      "required": false,
      "surface": "compose",
      "type": null
    },
    {
      "classification": [
        "runtime",
        "secret"
      ],
      "consumed_by": [
        "agents",
        "chrome-devtools-mcp",
        "compose:chrome-devtools-mcp"
      ],
      "declared_in": [
        "backend/app/core/config.py",
        "backend/.env.example",
        "docker-compose.yml"
      ],
      "default": null,
      "default_class": "none",
      "name": "BROWSERLESS_TOKEN",
      "required": false,
      "surface": "backend",
      "type": "SecretStr"
    },
    {
      "classification": [
        "compose-only"
      ],
      "consumed_by": [
        "compose:docling-mcp"
      ],
      "declared_in": [
        "docker-compose.yml"
      ],
      "default": null,
      "default_class": "none",
      "name": "CACHE_DIR",
      "required": false,
      "surface": "compose",
      "type": null
    },
    {
      "classification": [
        "runtime"
      ],
      "consumed_by": [],
      "declared_in": [
        "backend/app/core/config.py",
        "backend/.env.example"
      ],
      "default": "docling",
      "default_class": "literal",
      "description": "Chat PDF parser: docling with PyMuPDF fallback, or pymupdf/llamaparse",
      "name": "CHAT_PDF_PARSER",
      "required": false,
      "surface": "backend",
      "type": "Literal['pymupdf', 'llamaparse', 'docling']"
    },
    {
      "classification": [
        "compose-only"
      ],
      "consumed_by": [
        "compose:codecov-frontend",
        "compose:codecov-gateway"
      ],
      "declared_in": [
        "docker-compose.yml"
      ],
      "default": null,
      "default_class": "none",
      "name": "CODECOV_API_HOST",
      "required": false,
      "surface": "compose",
      "type": null
    },
    {
      "classification": [
        "compose-only"
      ],
      "consumed_by": [
        "compose:codecov-frontend"
      ],
      "declared_in": [
        "docker-compose.yml"
      ],
      "default": null,
      "default_class": "none",
      "name": "CODECOV_BASE_HOST",
      "required": false,
      "surface": "compose",
      "type": null
    },
    {
      "classification": [
        "compose-only",
        "secret"
      ],
      "consumed_by": [
        "codecov"
      ],
      "declared_in": [
        "backend/.env.example",
        "docker-compose.yml"
      ],
      "default": null,
      "default_class": "none",
      "description": "Session cookie signing key (long random string; rotating it logs everyone out)",
      "name": "CODECOV_COOKIE_SECRET",
      "required": false,
      "surface": "backend",
      "type": null
    },
    {
      "classification": [
        "compose-only"
      ],
      "consumed_by": [
        "compose:codecov-gateway"
      ],
      "declared_in": [
        "docker-compose.yml"
      ],
      "default": null,
      "default_class": "none",
      "name": "CODECOV_DEFAULT_HOST",
      "required": false,
      "surface": "compose",
      "type": null
    },
    {
      "classification": [
        "compose-only"
      ],
      "consumed_by": [
        "compose:codecov-gateway"
      ],
      "declared_in": [
        "docker-compose.yml"
      ],